<?xml version="1.0" encoding="iso-8859-1" standalone="no"?>
<!DOCTYPE document SYSTEM "/home3/r/rj002007/workspace/xml/Jeremy/tp1jeremy/forrest.dtd">
<!-- ERREUR 7, 8 CORRIGEE : standalone  , iso-->
<?xml-stylesheet type="text/xsl" href="fg.xsl"?>
<!-- à relire -->
<?robots index="yes" follow="no"?>
<document>
    <titre style="bold" Style="big">Mes mémoires</titre>
    <auteur>
        <nom>Gump</nom>
        <prénom>Forrest</prénom>
    </auteur><!-- ERREUR 1 CORRIGE -->
 <description xmlns="http://www.w3.org/1999/xhtml"
style="bold" Style="big" xml:space="preserve"> 
        <!-- à partir d'ici, on peut utiliser
        des éléments HTML  <!&#45;&#45; et d'autres aussi &#45;&#45;>
        c'est pratique pour du contenu
        documentaire --> <!-- ERREUR 2, 9 CORRIGE -->
        <p xml:space="default" align="center">Ma maman disait <!-- ERREUR 4 CORRIGE : "center-->
            toujours : &#xA; "<i>la vie c'est comme une
                boîte de <b>chocolat</b>, on ne sait jamais
            sur quoi on va tomber</i>".</p> <!-- ERREUR 3, 10 CORRIGE -->
    <hr width="100"/> <!-- ERREUR 6 CORRIGE : valeur  pour width -->
    <a  xlink:href="bubbagump.avi"
        xmlns:xlink="http://www.w3.org/1999/xlink"
        href="bubbagump.avi"
        xlink:role="mon film">
        <object 
                xlink:href="bubbagump.avi"/> <!-- ERREUR 11 CORRIGEE -->
    </a>
    <script language="JavaScript">
        <![CDATA[
            function check() {
                for (int i=10; i>0; i--) {
                    if ( a[b[i]] > ]]>5 ) break;
        }
        }
       <!-- ERREUR 12 CORRIGEE -->
        <!-- vérifier si la boucle doit s'écrire
        avec i&#45;&#45; et pas i++ --> <!-- ERREUR 13 CORRIGEE -->
    </script>
    <p>La suite, je ne m'en souviens plus...</p> <!--  ERREUR 5 CORRIGE : fin du </p> -->
    </description>
    <xml_parse processor="JAXP"/>

<remarques>
Mon document ne parse pas
</remarques>
</document> <!-- ERREUR 14 CORRIGEE -->
        <!-- il y a quelques erreurs ERREUR 15 CORRIGEE-->
        